{
  "protocolVersion": 1,
  "messageId": "40000000-0000-4000-8000-000000000001",
  "type": "dom_step",
  "sentAt": "2026-01-15T15:00:01.000Z",
  "payload": {
    "sessionId": "10000000-0000-4000-8000-000000000001",
    "stepId": "20000000-0000-4000-8000-000000000002",
    "action": "input",
    "instruction": "Enter the requested value in Synthetic request label."
  }
}
